{
  "schema": "wellmanifest.project-ssot/interview/v1",
  "subject_id": "wellmanifest.ssot",
  "name": "Wellmanifest SSOT decision DSL",
  "version": "0.2.0-dev",
  "placement": {
    "home": "wellmanifest",
    "shape": "domain_pack",
    "runtimeOwner": "wellmanifest",
    "adopt": [
      "wellmanifest/dsl",
      "wellmanifest/ssot",
      "wellmanifest/new-project"
    ]
  },
  "purpose": "Interview-driven classification of duplicated trees into propose-only SSOT decisions",
  "owners": ["github:wellmanifest/ssot"],
  "purpose_authority": "dsl-manifest",
  "readme_role": "facade",
  "divergence_reason": "Polish README intro and English marketing tone may differ from the schema purpose; the JSON AST remains canonical.",
  "analyzer_present": true,
  "analyzer_kind": "code2llm-toon",
  "analyzer_noise": true,
  "human_confirmed_debt": false
}
